<?xml version="1.0" encoding="UTF-8"?>
<xdbd_trigger_root
 xmlns:xsi='http://www.w3.org/2001/XMLSchema-instance'
 xsi:noNamespaceSchemaLocation='xdbd_trigger.xsd'>
 <xdbd_trigger>
  <trigger_id>1</trigger_id>
  <trigger_name>trigger_h248_nonstd_prf</trigger_name>
  <trigger_library>libxdbdsdltrigger.so</trigger_library>
  <trigger_load>nmFunc_h248_nonstd_prf_load</trigger_load>
  <trigger_fire>nmFunc_h248_nonstd_prf_fire</trigger_fire>
  <trigger_unload>nmFunc_h248_nonstd_prf_unload</trigger_unload>
  <trigger_table>h248_nonstd_prf</trigger_table>
  <trigger_function>14</trigger_function>
 </xdbd_trigger>
 <xdbd_trigger>
  <trigger_id>2</trigger_id>
  <trigger_name>trigger_vxml_config</trigger_name>
  <trigger_library>libxdbdsdltrigger.so</trigger_library>
  <trigger_load>nmFunc_vxml_config_load</trigger_load>
  <trigger_fire>nmFunc_vxml_config_fire</trigger_fire>
  <trigger_unload>nmFunc_vxml_config_unload</trigger_unload>
  <trigger_table>vxml_config</trigger_table>
  <trigger_function>14</trigger_function>
 </xdbd_trigger>
 <xdbd_trigger>
  <trigger_id>3</trigger_id>
  <trigger_name>trigger_vxml_server</trigger_name>
  <trigger_library>libxdbdsdltrigger.so</trigger_library>
  <trigger_load>nmFunc_vxml_server_load</trigger_load>
  <trigger_fire>nmFunc_vxml_server_fire</trigger_fire>
  <trigger_unload>nmFunc_vxml_server_unload</trigger_unload>
  <trigger_table>vxml_server</trigger_table>
  <trigger_function>14</trigger_function>
 </xdbd_trigger>
 <xdbd_trigger>
  <trigger_id>5</trigger_id>
  <trigger_name>trigger_vxml_trace</trigger_name>
  <trigger_library>libxdbdsdltrigger.so</trigger_library>
  <trigger_load>nmFunc_vxml_trace_load</trigger_load>
  <trigger_fire>nmFunc_vxml_trace_fire</trigger_fire>
  <trigger_unload>nmFunc_vxml_trace_unload</trigger_unload>
  <trigger_table>vxml_trace</trigger_table>
  <trigger_function>14</trigger_function>
 </xdbd_trigger>
 <xdbd_trigger>
  <trigger_id>6</trigger_id>
  <trigger_name>trigger_sys_interface</trigger_name>
  <trigger_library>libxdbdsdltrigger.so</trigger_library>
  <trigger_load>nmFunc_sys_interface_load</trigger_load>
  <trigger_fire>nmFunc_sys_interface_fire</trigger_fire>
  <trigger_unload>nmFunc_sys_interface_unload</trigger_unload>
  <trigger_table>sys_interface</trigger_table>
  <trigger_function>14</trigger_function>
 </xdbd_trigger>
</xdbd_trigger_root>
