<?xml version="1.0" encoding="UTF-8"?>
<xdbd_trigger_root
 xmlns:xsi='http://www.w3.org/2001/XMLSchema-instance'
 xsi:noNamespaceSchemaLocation='xdbd_trigger.xsd'>
 <xdbd_trigger>
  <trigger_id>1</trigger_id>
  <trigger_name>trigger_syslog_client</trigger_name>
  <trigger_library>libxdbdmqtrigger.so</trigger_library>
  <trigger_load>nmFunc_syslog_client_load</trigger_load>
  <trigger_fire>nmFunc_syslog_client_fire</trigger_fire>
  <trigger_unload>nmFunc_syslog_client_unload</trigger_unload>
  <trigger_table>syslog_client</trigger_table>
  <trigger_function>14</trigger_function>
 </xdbd_trigger>
 <xdbd_trigger>
  <trigger_id>2</trigger_id>
  <trigger_name>trigger_filter</trigger_name>
  <trigger_library>libxdbdmqtrigger.so</trigger_library>
  <trigger_load>nmFunc_filter_load</trigger_load>
  <trigger_fire>nmFunc_filter_fire</trigger_fire>
  <trigger_unload>nmFunc_filter_unload</trigger_unload>
  <trigger_table>filter</trigger_table>
  <trigger_function>14</trigger_function>
 </xdbd_trigger>
 <xdbd_trigger>
  <trigger_id>3</trigger_id>
  <trigger_name>trigger_basic_filter</trigger_name>
  <trigger_library>libxdbdmqtrigger.so</trigger_library>
  <trigger_load>nmFunc_basic_filter_load</trigger_load>
  <trigger_fire>nmFunc_basic_filter_fire</trigger_fire>
  <trigger_unload>nmFunc_basic_filter_unload</trigger_unload>
  <trigger_table>basic_filter</trigger_table>
  <trigger_function>14</trigger_function>
 </xdbd_trigger>
 <xdbd_trigger>
  <trigger_id>4</trigger_id>
  <trigger_name>trigger_ip_route</trigger_name>
  <trigger_library>libxdbdmqtrigger.so</trigger_library>
  <trigger_load>nmFunc_ip_route_load</trigger_load>
  <trigger_fire>nmFunc_ip_route_fire</trigger_fire>
  <trigger_unload>nmFunc_ip_route_unload</trigger_unload>
  <trigger_table>ip_route</trigger_table>
  <trigger_function>14</trigger_function>
 </xdbd_trigger>
 <xdbd_trigger>
  <trigger_id>5</trigger_id>
  <trigger_name>trigger_error_filter</trigger_name>
  <trigger_library>libxdbdmqtrigger.so</trigger_library>
  <trigger_load>nmFunc_error_filter_load</trigger_load>
  <trigger_fire>nmFunc_error_filter_fire</trigger_fire>
  <trigger_unload>nmFunc_error_filter_unload</trigger_unload>
  <trigger_table>error_filter</trigger_table>
  <trigger_function>14</trigger_function>
 </xdbd_trigger>
 <xdbd_trigger>
  <trigger_id>6</trigger_id>
  <trigger_name>trigger_filter_grp_member</trigger_name>
  <trigger_library>libxdbdmqtrigger.so</trigger_library>
  <trigger_load>nmFunc_filter_grp_member_load</trigger_load>
  <trigger_fire>nmFunc_filter_grp_member_fire</trigger_fire>
  <trigger_unload>nmFunc_filter_grp_member_unload</trigger_unload>
  <trigger_table>filter_grp_member</trigger_table>
  <trigger_function>14</trigger_function>
 </xdbd_trigger>
 <xdbd_trigger>
  <trigger_id>7</trigger_id>
  <trigger_name>trigger_test_program</trigger_name>
  <trigger_library>libxdbdmqtrigger.so</trigger_library>
  <trigger_load>nmFunc_test_program_load</trigger_load>
  <trigger_fire>nmFunc_test_program_fire</trigger_fire>
  <trigger_unload>nmFunc_test_program_unload</trigger_unload>
  <trigger_table>test_program</trigger_table>
  <trigger_function>14</trigger_function>
 </xdbd_trigger>
 <xdbd_trigger>
  <trigger_id>8</trigger_id>
  <trigger_name>trigger_eth_interface</trigger_name>
  <trigger_library>libxdbdmqtrigger.so</trigger_library>
  <trigger_load>nmFunc_eth_interface_load</trigger_load>
  <trigger_fire>nmFunc_eth_interface_fire</trigger_fire>
  <trigger_unload>nmFunc_eth_interface_unload</trigger_unload>
  <trigger_table>eth_interface</trigger_table>
  <trigger_function>14</trigger_function>
 </xdbd_trigger>
 <xdbd_trigger>
  <trigger_id>9</trigger_id>
  <trigger_name>trigger_ip_device</trigger_name>
  <trigger_library>libxdbdmqtrigger.so</trigger_library>
  <trigger_load>nmFunc_ip_device_load</trigger_load>
  <trigger_fire>nmFunc_ip_device_fire</trigger_fire>
  <trigger_unload>nmFunc_ip_device_unload</trigger_unload>
  <trigger_table>ip_device</trigger_table>
  <trigger_function>14</trigger_function>
 </xdbd_trigger>
</xdbd_trigger_root>
